{
  "kit_application": "USD Composer 110.1.0",
  "so_extension_version": "110.0.4",
  "so_build_date": "2026-02-12T00:00:00Z",
  "operations_available": [
    "boxClip",
    "computeExtents",
    "countVertices",
    "decimateMeshes",
    "deduplicateGeometry",
    "deleteHiddenPrims",
    "deletePrims",
    "diceMeshes",
    "editStageMetrics",
    "findCoincidingGeometry",
    "findFlatHierarchies",
    "findOccludedMeshes",
    "fitPrimitives",
    "flattenHierarchy",
    "generateAtlasUVs",
    "generateNormals",
    "generateProjectionUVs",
    "generateScene",
    "manifoldMeshes",
    "merge",
    "mergeVertices",
    "meshCleanup",
    "optimizeMaterials",
    "optimizePrimvars",
    "optimizeSkelRoots",
    "optimizeTimeSamples",
    "organizePrototypes",
    "pivot",
    "primitivesToMeshes",
    "printStats",
    "pruneLeaves",
    "pythonScript",
    "remeshMeshes",
    "removeAttributes",
    "removePrims",
    "removeSmallGeometry",
    "removeUntypedPrims",
    "removeUnusedUVs",
    "rtxMeshCount",
    "sparseMeshes",
    "splitMeshes",
    "subdivideMeshes",
    "triangulateMeshes",
    "utilityFunction"
  ],
  "probed_at": "2026-05-14T07:47:57Z",
  "notes": "Captured under USD Composer 110.1.0 + Kit Python with omni.scene.optimizer.core enabled, --no-window. so_build_date set to 2026-02-12T00:00:00Z — an approximation a day after the public-source-dump cut, sufficient to cover ops committed during the dump (which carry UTC timestamps around 2026-02-11T07:51Z). Exact build date is unknown because the SO extension package metadata does not expose buildTime or a build SHA. so_extension_version manually copied from the Kit log line '[ext: omni.scene.optimizer.core-110.0.4]' since get_extension_dict returned an empty package block in this build."
}
